{
  "id": "INT-012",
  "candidate_sha256": "205170caa29271f5b550818991102937c45394c98f960a54ee65e113528eb80f",
  "result": "PASS",
  "executed_at": "2026-07-22T19:12:21.687691+00:00",
  "environment": {},
  "evidence": [
    "dist\\COPA DOS SONHOS - R14 - MOTOR VIVO.html"
  ],
  "metrics": {},
  "notes": "SHA 205170caa29271f5…",
  "bug_or_commit": "205170caa292"
}