{
  "id": "DET-025",
  "candidate_sha256": "205170caa29271f5b550818991102937c45394c98f960a54ee65e113528eb80f",
  "result": "PASS",
  "executed_at": "2026-07-22T19:12:21.687691+00:00",
  "environment": {},
  "evidence": [
    "tools/verify_r13.py"
  ],
  "metrics": {},
  "notes": "rebuild byte-idêntico 363d9a91…, smoke 13/13, cenários 25/25",
  "bug_or_commit": "205170caa292"
}