{
  "id": "BOL-044",
  "candidate_sha256": "205170caa29271f5b550818991102937c45394c98f960a54ee65e113528eb80f",
  "result": "PASS",
  "executed_at": "2026-07-22T22:59:14.338119+00:00",
  "environment": {},
  "evidence": [],
  "metrics": {
    "exigido": "tiros de meta sem colapso, referência 7,71/jogo",
    "observado": "7.33/jogo"
  },
  "notes": "Critério avaliado item a item por eval_controls.py",
  "bug_or_commit": ""
}